[
  {
    "adapter_name": "",
    "drawing": "static/module/with_labware/mag`shaker.png",
    "image": "static/module/without_labware/mag`shaker.png",
    "is_available": true,
    "is_required_adapter": false,
    "key": "magnetic_shaker",
    "order_id": 1,
    "product_name": "Magnetic Shaker",
    "spec": {
      "offset_x": 0,
      "offset_y": 0,
      "offset_z": 103
    },
    "type": "magnetic_shaker"
  },
  {
    "adapter_name": "",
    "drawing": "static/module/with_labware/coldplate.svg",
    "image": "static/module/without_labware/coldplate.jpg",
    "is_available": true,
    "is_required_adapter": false,
    "key": "coldplate",
    "order_id": 3,
    "product_name": "Cold Plate",
    "spec": {
      "offset_x": 0,
      "offset_y": 0,
      "offset_z": 86
    },
    "type": "coldplate"
  },
  {
    "adapter_name": "96 V-bottom",
    "drawing": "static/module/with_labware/coldplate.svg",
    "image": "static/module/without_labware/coldplate.jpg",
    "is_available": true,
    "is_required_adapter": true,
    "key": "coldplate_96V-bottom",
    "order_id": 3,
    "product_name": "Cold Plate",
    "spec": {
      "offset_x": 0,
      "offset_y": 0,
      "offset_z": 90
    },
    "type": "coldplate"
  },
  {
    "adapter_name": "",
    "drawing": "static/module/with_labware/odtc.svg",
    "image": "static/module/without_labware/odtc.png",
    "is_available": true,
    "is_required_adapter": false,
    "key": "odtc",
    "order_id": 4,
    "product_name": "ODTC",
    "spec": {
      "offset_x": -5.5,
      "offset_y": 10,
      "offset_z": 93.5
    },
    "type": "odtc"
  },
  {
    "adapter_name": "",
    "drawing": "static/module/with_labware/shaker.svg",
    "image": "static/module/without_labware/shaker.png",
    "is_available": true,
    "is_required_adapter": false,
    "key": "shaker",
    "order_id": 4,
    "product_name": "Shaker",
    "spec": null,
    "type": "shaker"
  }
]